id,headline,url,source,source_type,author,published_at,section,collection_method,scraped_at,feed_url
93f640e2ef7b03c7,¿Por qué los hombres son infieles con mujeres menos atractivas que su pareja?,https://www.publimetro.cl/estilo-vida/2026/04/17/por-que-los-hombres-son-infieles-con-mujeres-menos-atractivas-que-su-pareja/,Publimetro Chile,nacional,Nueva Mujer,2026-04-17T02:08:03-04:00,Estilo de Vida,sitemap_article,2026-04-18T22:39:36.085573+00:00,
738e75745ba3bc21,Gobierno paraliza obras del GAM y pone fin anticipado a contrato por restricciones presupuestarias,https://www.publimetro.cl/noticias/2026/04/17/gobierno-paraliza-obras-del-gam-y-pone-fin-anticipado-a-contrato-por-restricciones-presupuestarias/,Publimetro Chile,nacional,Angélica Baeza,2026-04-17T06:54:57-04:00,Noticias,sitemap_article,2026-04-18T22:39:33.914065+00:00,
bdda77860eb36d88,Video muestra violento atropello de camión de Prosegur a dos mujeres en Pucón: una quedó grave,https://www.publimetro.cl/noticias/2026/04/17/video-muestra-violento-atropello-de-camion-de-prosegur-a-dos-mujeres-en-pucon-una-quedo-grave/,Publimetro Chile,nacional,Angélica Baeza,2026-04-17T07:17:40-04:00,Noticias,sitemap_article,2026-04-18T22:39:32.444781+00:00,
f7672408960eded7,"Detienen a estudiante por amenaza de tiroteo en universidad Central de La Serena: “Cuando lo publiqué, mi intención era tirar la talla”",https://www.publimetro.cl/noticias/2026/04/17/detienen-a-estudiante-por-amenaza-de-tiroteo-en-universidad-central-de-la-serena-cuando-lo-publique-mi-intencion-era-tirar-la-talla/,Publimetro Chile,nacional,Angélica Baeza,2026-04-17T07:48:55-04:00,Noticias,sitemap_article,2026-04-18T22:39:30.911348+00:00,
4d55decba7600ac4,“Voy a tomarme la libertad de seguir contando cosas que son súper incómodas y que están bajo el alero de un gobierno de extrema derecha”: la advertencia de Jordi Castell,https://www.publimetro.cl/social/2026/04/17/voy-a-tomarme-la-libertad-de-seguir-contando-cosas-que-son-super-incomodas-y-que-estan-bajo-el-alero-de-un-gobierno-de-extrema-derecha-la-advertencia-de-jordi-castell/,Publimetro Chile,nacional,Angélica Baeza,2026-04-17T08:22:50-04:00,Social,sitemap_article,2026-04-18T22:39:29.350808+00:00,
dca4ede814e92d71,¿Cuándo va a llover en Santiago? Iván Torres realizó un ajuste en el pronóstico sobre el retorno de los chubascos a la capital,https://www.publimetro.cl/noticias/2026/04/17/cuando-va-a-llover-en-santiago-ivan-torres-realizo-un-ajuste-en-el-pronostico-sobre-el-retorno-de-los-chubascos-a-la-capital/,Publimetro Chile,nacional,María Paz Núñez,2026-04-17T08:45:19-04:00,Noticias,sitemap_article,2026-04-18T22:39:29.075409+00:00,
02f05209e8e036d3,Camilo Huerta revela íntimo detalle de su relación con Marité Matus: “Te empieza como a comprar”,https://www.publimetro.cl/entretenimiento/2026/04/17/camilo-huerta-revela-intimo-detalle-de-su-relacion-con-marite-matus-te-empieza-como-a-comprar/,Publimetro Chile,nacional,Angélica Baeza,2026-04-17T08:50:16-04:00,Entretenimiento,sitemap_article,2026-04-18T22:39:27.531393+00:00,
b3a28a1b3f187a51,Álvaro Ballero revela distanciamiento con Arturo Longton: “Está enojado conmigo”,https://www.publimetro.cl/entretenimiento/2026/04/17/alvaro-ballero-revela-distanciamiento-con-arturo-longton-esta-enojado-conmigo/,Publimetro Chile,nacional,Angélica Baeza,2026-04-17T09:15:45-04:00,Entretenimiento,sitemap_article,2026-04-18T22:39:25.916601+00:00,
8348d31d27db9852,“Mucha gente dice que tengo la tremenda facha...”: Evelyn Matthei publicó un video especial para sus “haters y bots” y la rompió en redes sociales,https://www.publimetro.cl/social/2026/04/17/mucha-gente-dice-que-tengo-la-tremenda-facha-evelyn-matthei-publico-un-video-especial-para-sus-haters-y-bots-y-la-rompio-en-redes-sociales/,Publimetro Chile,nacional,María Paz Núñez,2026-04-17T09:25:37-04:00,Social,sitemap_article,2026-04-18T22:39:24.390509+00:00,
a9280e0c1582a811,Cadem y plan de reconstrucción anunciado por el Presidente Kast: 49% está de acuerdo con las medidas anunciadas en cadena nacional,https://www.publimetro.cl/noticias/2026/04/17/cadem-y-plan-de-reconstruccion-anunciado-por-el-presidente-kast-49-esta-de-acuerdo-con-las-medidas-anunciadas-en-cadena-nacional/,Publimetro Chile,nacional,María Paz Núñez,2026-04-17T10:23:24-04:00,Noticias,sitemap_article,2026-04-18T22:39:22.618099+00:00,
d9bb3a16de1ddc80,Querella de Aduanas permitió prisión preventiva para hombres que tapaban zanja en Colchane,https://www.publimetro.cl/noticias/2026/04/17/querella-de-aduanas-permite-prision-preventiva-para-hombres-que-tapaban-zanja-en-colchane/,Publimetro Chile,nacional,Angélica Baeza,2026-04-17T10:27:03-04:00,Noticias,sitemap_article,2026-04-18T22:39:21.143244+00:00,
26b5b7a98d848642,Gobierno de Kast solicitó la renuncia a la directora del Servicio Médico Legal: argumentaron pérdida legítima de la confianza,https://www.publimetro.cl/noticias/2026/04/17/gobierno-de-kast-solicito-la-renuncia-a-la-directora-del-servicio-medico-legal-argumentaron-perdida-legitima-de-la-confianza/,Publimetro Chile,nacional,Martín Toro,2026-04-17T11:00:54-04:00,Noticias,sitemap_article,2026-04-18T22:39:19.147077+00:00,
d39e925022255b50,Tras inspeccionar el estadio de Colo Colo: delegado presidencial Germán Codina quiere que “todos los partidos” tengan público local y visitante,https://www.publimetro.cl/deportes/2026/04/17/tras-inspeccionar-el-estadio-de-colo-colo-delegado-presidencial-german-codina-quiere-que-todos-los-partidos-tengan-publico-local-y-visitante/,Publimetro Chile,nacional,María Paz Núñez,2026-04-17T11:23:29-04:00,Deportes,sitemap_article,2026-04-18T22:39:17.605560+00:00,
bc5f1b543952fae2,Presidente de la AChM por reposición parcial del fondo común municipal: “Con el municipalismo no se juega”,https://www.publimetro.cl/noticias/2026/04/17/presidente-de-la-achm-por-reposicion-parcial-del-fondo-comun-municipal-con-el-municipalismo-no-se-juega/,Publimetro Chile,nacional,Angélica Baeza,2026-04-17T11:35:08-04:00,Noticias,sitemap_article,2026-04-18T22:39:17.350107+00:00,
3b750cc8f39bc12c,¿Cuánto sabes sobre Lamine Yamal?,https://www.publimetro.cl/deportes/2026/04/17/cuanto-sabes-sobre-lamine-yamal/,Publimetro Chile,nacional,Said Pulido,2026-04-17T11:46:44-04:00,Deportes,sitemap_article,2026-04-18T22:39:15.945538+00:00,
61055dd978b2c7be,"“Yo le creí, me quedé tranquilo...”: Koke Santa Ana salió al paso de los rumores y negó tajantemente haber tenido una relación con Javier Fernández",https://www.publimetro.cl/social/2026/04/17/yo-le-crei-me-quede-tranquilo-koke-santa-ana-salio-al-paso-de-los-rumores-y-nego-tajantemente-haber-tenido-una-relacion-con-javier-fernandez/,Publimetro Chile,nacional,María Paz Núñez,2026-04-17T12:04:27-04:00,Social,sitemap_article,2026-04-18T22:39:14.318244+00:00,
1b1da73ca2ddc563,Claudia Conserva vuelve a Canal 13 después de 20 años para liderar el regreso de “Milf”:“Es nuestro escenario ideal”,https://www.publimetro.cl/entretenimiento/2026/04/17/claudia-conserva-vuelve-a-canal-13-despues-de-20-anos-para-liderar-el-regreso-de-milfes-nuestro-escenario-ideal/,Publimetro Chile,nacional,Angélica Baeza,2026-04-17T12:08:53-04:00,Entretenimiento,sitemap_article,2026-04-18T22:39:12.398603+00:00,
2e45326d9596cdda,Recibió la furia de la Leona: Adriana Barrientos desclasificó encontrón con Camilo Huerta cuando estaba en restaurante con su mamá,https://www.publimetro.cl/entretenimiento/2026/04/17/recibio-la-furia-de-la-leona-adriana-barrientos-desclasifico-encontron-con-camilo-huerta-cuando-estaba-en-restaurante-con-su-mama/,Publimetro Chile,nacional,Martín Toro,2026-04-17T12:09:33-04:00,Entretenimiento,sitemap_article,2026-04-18T22:39:14.071198+00:00,
48247f9f248a8690,El adiós al modelo tradicional: Estudios confirman que el dolor crónico nace en el cuerpo pero se alimenta de la mente,https://www.publimetro.cl/social/2026/04/17/el-adios-al-modelo-tradicional-estudios-confirman-que-el-dolor-cronico-nace-en-el-cuerpo-pero-se-alimenta-de-la-mente/,Publimetro Chile,nacional,Consuelo Rehbein Caerols,2026-04-17T12:13:21-04:00,Social,sitemap_article,2026-04-18T22:38:56.494794+00:00,
0e4ff3eb83c9c1b5,Los robots ya tienen sentido común: La nueva IA de Google les permite planificar y actuar en el mundo real,https://www.publimetro.cl/tecnologia/2026/04/17/los-robots-ya-tienen-sentido-comun-la-nueva-ia-de-google-les-permite-planificar-y-actuar-en-el-mundo-real/,Publimetro Chile,nacional,Consuelo Rehbein Caerols,2026-04-17T12:42:58-04:00,Tecnología,sitemap_article,2026-04-18T22:38:54.884428+00:00,
48293678086fa99e,Aprende a aplicar el ‘Hygge’ a la decoración del hogar,https://www.publimetro.cl/estilo-vida/2026/04/17/aprende-a-aplicar-el-hygge-a-la-decoracion-del-hogar/,Publimetro Chile,nacional,Said Pulido,2026-04-17T12:44:33-04:00,Estilo de Vida,sitemap_article,2026-04-18T22:39:12.152613+00:00,
0c13bee844496503,“Me gustaría conversar con él”: Camilo Huerta reconoció que quiere hablar con Bimza sobre su relación con Trini Neira,https://www.publimetro.cl/entretenimiento/2026/04/17/me-gustaria-conversar-con-el-camilo-huerta-reconocio-que-quiere-hablar-con-bimza-sobre-su-relacion-con-trini-neira/,Publimetro Chile,nacional,María Paz Núñez,2026-04-17T13:07:03-04:00,Entretenimiento,sitemap_article,2026-04-18T22:39:10.648932+00:00,
eb886f1cc6e497de,¿Fue contactado por Chilevisión?: Rodrigo Sepúlveda rompió el silencio sobre el rumor que se sumaría a “Contigo en la mañana”,https://www.publimetro.cl/entretenimiento/2026/04/17/fue-contactado-por-chilevision-rodrigo-sepulveda-rompio-el-silencio-sobre-el-rumor-que-se-sumaria-a-contigo-en-la-manana/,Publimetro Chile,nacional,Martín Toro,2026-04-17T13:17:50-04:00,Entretenimiento,sitemap_article,2026-04-18T22:39:10.388457+00:00,
683a63ffe79e4dad,Mineduc entrega Información de Nivel Socioeconómico a estudiantes que postularon a beneficios estudiantiles,https://www.publimetro.cl/noticias/2026/04/17/mineduc-entrega-informacion-de-nivel-socioeconomico-a-estudiantes-que-postularon-a-beneficios-estudiantiles/,Publimetro Chile,nacional,Angélica Baeza,2026-04-17T13:42:03-04:00,Noticias,sitemap_article,2026-04-18T22:39:10.150067+00:00,
71d4d2e88fc339ff,Camioneros descartan paralización tras reunión con el gobierno: dan plazo de 20 días para obtener respuesta a sus demandas,https://www.publimetro.cl/noticias/2026/04/17/camioneros-descartan-paralizacion-tras-reunion-con-el-gobierno-dan-plazo-de-20-dias-para-obtener-respuesta-a-sus-demandas/,Publimetro Chile,nacional,María Paz Núñez,2026-04-17T14:17:37-04:00,Noticias,sitemap_article,2026-04-18T22:39:08.489115+00:00,
f5d9bc31b5903f9c,“Él me hizo pasar por un infierno“: Gatita Veve se defiende de los cuestionamientos sobre su testimonio de VIF,https://www.publimetro.cl/entretenimiento/2026/04/17/el-me-hizo-pasar-por-un-infierno-gatita-veve-se-defiende-de-los-cuestionamientos-sobre-su-testimonio-de-vif/,Publimetro Chile,nacional,Martín Toro,2026-04-17T14:36:56-04:00,Entretenimiento,sitemap_article,2026-04-18T22:39:07.532025+00:00,
e4985d5f61baa8cc,Gobierno da pie atrás: Descarta limitar gratuidad universitaria a mayores de 30 años,https://www.publimetro.cl/noticias/2026/04/17/gobierno-da-pie-atras-descarta-limitar-gratuidad-universitaria-a-mayores-de-30-anos/,Publimetro Chile,nacional,Angélica Baeza,2026-04-17T15:34:30-04:00,Noticias,sitemap_article,2026-04-18T22:39:05.982288+00:00,
1862db3345d29a34,Paskurana estrena “Polillas” y confirma gira por Chile tras su paso por Europa,https://www.publimetro.cl/entretenimiento/2026/04/17/paskurana-estrena-polillas-y-confirma-gira-por-chile-tras-su-paso-por-europa/,Publimetro Chile,nacional,Sebastian Huerta Viurcos,2026-04-17T15:44:42-04:00,Entretenimiento,sitemap_article,2026-04-18T22:39:05.746265+00:00,
3d155811009d77f2,Ministro del Interior confirma cambios en la entrega de subsidio para el gas: se hará por transferencia directa a los beneficiados,https://www.publimetro.cl/noticias/2026/04/17/ministro-del-interior-confirma-cambios-en-la-entrega-de-subsidio-para-el-gas-se-hara-por-transferencia-directa-a-los-beneficiados/,Publimetro Chile,nacional,María Paz Núñez,2026-04-17T15:56:57-04:00,Noticias,sitemap_article,2026-04-18T22:39:03.053683+00:00,
8d7677b2a64f4445,"Comer pan podría hacerte subir de peso, incluso sin comer más",https://www.publimetro.cl/estilo-vida/2026/04/17/comer-pan-podria-hacerte-subir-de-peso-incluso-sin-comer-mas/,Publimetro Chile,nacional,Daniel Casillas,2026-04-17T15:57:10-04:00,Estilo de Vida,sitemap_article,2026-04-18T22:39:02.096446+00:00,
1b3929079a291053,"Francisco Kaminski furia a las afueras de Tribunales: “Yo no debo lo que ustedes dicen, no hablen tanta mentira”",https://www.publimetro.cl/entretenimiento/2026/04/17/francisco-kaminski-furia-a-las-afueras-de-tribunales-yo-no-debo-lo-que-ustedes-dicen-no-hablen-tanta-mentira/,Publimetro Chile,nacional,Martín Toro,2026-04-17T16:10:26-04:00,Entretenimiento,sitemap_article,2026-04-18T22:39:00.577601+00:00,
227cef8abd59a2b6,Sin depredadores y en expansión: El avance del visón americano que amenaza con llegar a Santiago,https://www.publimetro.cl/noticias/2026/04/17/sin-depredadores-y-en-expansion-el-avance-del-vison-americano-que-amenaza-con-llegar-a-santiago/,Publimetro Chile,nacional,Sebastian Huerta Viurcos,2026-04-17T16:22:46-04:00,Noticias,sitemap_article,2026-04-18T22:38:59.609873+00:00,
dd15013cda96b459,¿Sube o baja en tu ciudad? El mapa de las nuevas tarifas de la luz que golpearán el sur de Chile,https://www.publimetro.cl/noticias/2026/04/17/mapa-de-las-nuevas-tarifas-de-la-luz-que-golpearan-el-sur-de-chile/,Publimetro Chile,nacional,Sebastian Huerta Viurcos,2026-04-17T16:31:27-04:00,Noticias,sitemap_article,2026-04-18T22:38:58.018930+00:00,
1f073fadb954e312,"“Vivía con lo mínimo, con 180 lucas”: La esforzada historia del comediante Marcelo “Coronel” Valverde antes de su éxito",https://www.publimetro.cl/entretenimiento/2026/04/17/vivia-con-lo-minimo-con-180-lucas-la-esforzada-historia-del-comediante-marcelo-coronel-valverde-antes-de-su-exito/,Publimetro Chile,nacional,Martín Toro,2026-04-17T16:57:19-04:00,Entretenimiento,sitemap_article,2026-04-18T22:38:53.826200+00:00,
149a865ae3a9b27d,Canal Dos detiene emisiones por sanción del CNTV y pone fin a RT en Telecanal,https://www.publimetro.cl/noticias/2026/04/17/telecanal-suspende-transmisiones-por-7-dias-y-pone-fin-a-emision-de-rt-en-chile/,Publimetro Chile,nacional,Sebastian Huerta Viurcos,2026-04-17T17:47:02-04:00,Noticias,sitemap_article,2026-04-18T22:38:52.797659+00:00,
dce2296ae6c0fae3,PDI detiene a sospechoso clave por homicidio de Eugenio Nain y revela registro del operativo,https://www.publimetro.cl/noticias/2026/04/17/pdi-detiene-a-sospechoso-clave-por-homicidio-de-eugenio-nain-y-revela-registro-del-operativo/,Publimetro Chile,nacional,Sebastian Huerta Viurcos,2026-04-17T18:55:23-04:00,Noticias,sitemap_article,2026-04-18T22:38:52.516747+00:00,
0f5f258661ed569b,¿Qué dijo la “Dama de hierro”?: La sincera reacción de Francisca García-Huidobro al rumoreado fin de un programa de Chilevisión,https://www.publimetro.cl/entretenimiento/2026/04/17/que-dijo-la-dama-de-hierro-la-sincera-reaccion-de-francisca-garcia-huidobro-al-rumoreado-fin-de-un-programa-de-chilevision/,Publimetro Chile,nacional,Martín Toro,2026-04-17T19:01:30-04:00,Entretenimiento,sitemap_article,2026-04-18T22:38:51.520073+00:00,
e35e3fa73d16a038,"Laura Prieto deja Mega y ¿alista ingreso a “Vecinos al Límite”, el reality de Canal 13?",https://www.publimetro.cl/entretenimiento/2026/04/18/laura-prieto-deja-mega-y-alista-ingreso-a-vecinos-al-limite-el-reality-de-canal-13/,Publimetro Chile,nacional,Sebastian Huerta Viurcos,2026-04-17T21:02:42-04:00,Entretenimiento,sitemap_article,2026-04-18T22:38:50.505071+00:00,
c41212cc5f9d30d8,Gatita Veve se lanza contra Frank Low por agresiones: “Él no quiere aceptar que le gustan los hombres”,https://www.publimetro.cl/entretenimiento/2026/04/18/gatita-veve-reactiva-denuncia-contra-frank-low-tras-video-viral-y-expone-agresiones-en-redes/,Publimetro Chile,nacional,Sebastian Huerta Viurcos,2026-04-17T21:49:56-04:00,Entretenimiento,sitemap_article,2026-04-18T22:38:50.267543+00:00,
a386bdfedb485a67,Panamá 2026: Team Chile supera la docena de medallas tras una jornada dorada en el triatlón,https://www.publimetro.cl/deportes/2026/04/18/panama-2026-team-chile-supera-la-docena-de-medallas-tras-una-jornada-dorada-en-el-triatlon/,Publimetro Chile,nacional,Sebastian Huerta Viurcos,2026-04-17T22:29:45-04:00,Deportes,sitemap_article,2026-04-18T22:38:50.007306+00:00,
88c40f77457214a2,La entrega de créditos hipotecarios cayó un 14% en el último año: ¿Los compradores están modificando su estrategia de compra?,https://www.publimetro.cl/noticias/2026/04/18/la-entrega-de-creditos-hipotecarios-cayo-un-14-en-el-ultimo-ano-los-compradores-estan-modificando-su-estrategia-de-compra/,Publimetro Chile,nacional,Nicole Villanueva,2026-04-18T09:00:00-04:00,Noticias,sitemap_article,2026-04-18T22:38:49.758212+00:00,
38ae7582efe8e6de,Pablo Flamm: la voz de la radio que encontró en la cocina una segunda gran pasión,https://www.publimetro.cl/noticias/2026/04/18/pablo-flamm-la-voz-de-la-radio-que-encontro-en-la-cocina-una-segunda-gran-pasion/,Publimetro Chile,nacional,Nicole Villanueva,2026-04-18T10:00:00-04:00,Noticias,sitemap_article,2026-04-18T22:38:48.206008+00:00,
dcac217790f150ce,Irací Hassler tajante con la administración de Kast: “Cada día me sorprende más la indolencia que ha tenido este gobierno”,https://www.publimetro.cl/noticias/2026/04/18/iraci-hassler-tajante-con-la-administracion-de-kast-cada-dia-me-sorprende-mas-la-indolencia-que-ha-tenido-este-gobierno/,Publimetro Chile,nacional,Martín Toro,2026-04-18T11:23:44-04:00,Noticias,sitemap_article,2026-04-18T22:38:47.946236+00:00,
00cc434df93b48be,GOPE incauta más de 600 fuegos artificiales en las dependencias del Estadio Monumental previo al aniversario de Colo Colo,https://www.publimetro.cl/deportes/2026/04/18/gope-incauta-mas-de-600-fuegos-artificiales-en-las-dependencias-del-estadio-monumental-previo-al-aniversario-de-colo-colo/,Publimetro Chile,nacional,Martín Toro,2026-04-18T13:03:55-04:00,Deportes,sitemap_article,2026-04-18T22:38:47.514621+00:00,
28c0245005d7c968,Nueva caída del Ministerio Secretaría General de Gobierno: publican video con dos faltas ortográficas,https://www.publimetro.cl/noticias/2026/04/18/nueva-caida-del-ministerio-secretaria-general-de-gobierno-publican-video-con-dos-faltas-ortograficas/,Publimetro Chile,nacional,Martín Toro,2026-04-18T14:25:07-04:00,Noticias,sitemap_article,2026-04-18T22:38:46.775301+00:00,
b3b78dc6c8d0b5f1,Camilo Huerta le entregó su celular: Francisca García-Huidobro leyó los mensajes que intercambió con Trini Neira,https://www.publimetro.cl/entretenimiento/2026/04/18/camilo-huerta-le-entrego-su-celular-francisca-garcia-huidobro-leyo-los-mensajes-que-intercambio-con-trini-neira/,Publimetro Chile,nacional,Martín Toro,2026-04-18T16:05:23-04:00,Entretenimiento,sitemap_article,2026-04-18T22:38:47.278418+00:00,
d5f1e15779d42094,Encuesta AMUCH: 9 de cada 10 chilenos cree que el país no está preparado para enfrentar el envejecimiento,https://www.publimetro.cl/social/2026/04/18/encuesta-amuch-9-de-cada-10-chilenos-cree-que-el-pais-no-esta-preparado-para-enfrentar-el-envejecimiento/,Publimetro Chile,nacional,Martín Toro,2026-04-18T16:57:12-04:00,Social,sitemap_article,2026-04-18T22:38:47.023773+00:00,
7d3c1c0aa789bd63,Mario Desbordes se pronunció ante la eliminación de contribuciones: “Tendré que devolver Meiggs al comercio ambulante”,https://www.publimetro.cl/noticias/2026/04/18/mario-desbordes-se-pronuncio-ante-la-eliminacion-de-contribuciones-tendre-que-devolver-meiggs-al-comercio-ambulante/,Publimetro Chile,nacional,Martín Toro,2026-04-18T18:21:13-04:00,Noticias,sitemap_article,2026-04-18T22:38:46.550550+00:00,
d58a7af9eca1629a,"La rebeldía ante el olvido de Katherine Medel, la joven baleada por su pareja que protagonizó la campaña No lo dejes pasar: “Hay que ser lo más feliz que uno pueda”",https://www.theclinic.cl/2026/04/18/el-abandono-de-katherine-medel-la-joven-baleada-por-su-pareja-tras-protagonizar-la-campana-no-lo-dejes-pasar-te-van-dejando-de-lado-olvidando/,The Clinic,nacional,Sebastián Palma,2026-04-18T12:09:00+00:00,Reportajes,rss,2026-04-18T22:36:31.559768+00:00,https://www.theclinic.cl/feed/
dc30a27383caed46,"Pasé una noche en “Studio 54”, la fiesta +50 de Santiago Oriente: lo que encontré entre estufas, hits ochenteros y los paseos de la Tía Sonia",https://www.theclinic.cl/2026/04/18/pase-una-noche-en-studio-54-la-fiesta-50-de-santiago-oriente-lo-que-encontre-entre-estufas-hits-ochenteros-y-los-paseos-de-la-tia-sonia/,The Clinic,nacional,The Clinic,2026-04-18T12:10:00+00:00,Reportajes,rss,2026-04-18T22:36:31.559523+00:00,https://www.theclinic.cl/feed/
1d70de9371c6b12f,De la generación del Rincón del Vago a un resumen de ChatGPT: el desafío de fomentar la lectura en estudiantes chilenos que se niegan a tomar un libro,https://www.theclinic.cl/2026/04/18/de-la-generacion-del-rincon-del-vago-a-un-resumen-de-chatgpt-el-desafio-de-fomentar-la-lectura-en-estudiantes-chilenos-que-se-niegan-a-tomar-un-libro/,The Clinic,nacional,Carolina Mardones L.,2026-04-18T12:25:00+00:00,Reportajes,rss,2026-04-18T22:36:31.559245+00:00,https://www.theclinic.cl/feed/
e3f5abcbfcbc7e6f,Gremios de las Pymes acusan que proyecto del gobierno beneficia a las grandes empresas y alertan porque no consideró tasa preferencial para las pequeñas,https://www.theclinic.cl/2026/04/18/gremios-de-las-pymes-acusan-que-proyecto-del-gobierno-beneficia-a-las-grandes-empresas-y-alertan-porque-no-considero-tasa-preferencial-para-las-pequenas/,The Clinic,nacional,Victoria García,2026-04-18T12:30:00+00:00,Negocios,rss,2026-04-18T22:36:31.558864+00:00,https://www.theclinic.cl/feed/
e698ae9b44b16c2d,“El factor Elvis”: el exjefe de registro que incomoda al notario Francisco Leiva en medio de la investigación por nombramientos de cargos del Poder Judicial,https://www.theclinic.cl/2026/04/18/el-factor-elvis-el-exjefe-de-registro-que-incomoda-al-notario-francisco-leiva-en-medio-de-la-investigacion-por-nombramientos-de-cargos-del-poder-judicial/,The Clinic,nacional,Jaime Pinochet,2026-04-18T12:30:00+00:00,Reportajes,rss,2026-04-18T22:36:31.558483+00:00,https://www.theclinic.cl/feed/
6c9cae7cfa3f42a1,"“La democracia no es un estado natural de las cosas, tenemos que cultivarla día a día”: Boric rompe su silencio pospresidencial y hace un guiño a la candidatura de Bachelet a la ONU",https://www.theclinic.cl/2026/04/18/la-democracia-no-es-un-estado-natural-de-las-cosas-tenemos-que-cultivarla-dia-a-dia-boric-rompe-su-silencio-pospresidencial-y-hace-un-guino-a-la-candidatura-de-bachelet-a-la-onu/,The Clinic,nacional,The Clinic,2026-04-18T14:06:59+00:00,Política,rss,2026-04-18T22:36:31.558177+00:00,https://www.theclinic.cl/feed/
5edac54ecd65c899,“Existen inconsistencias u omisiones en su contabilidad electoral”: Las observaciones del Servel a la rendición de gastos de campaña de Arturo Squella,https://www.theclinic.cl/2026/04/18/existen-inconsistencias-u-omisiones-en-su-contabilidad-electoral-las-observaciones-del-servel-a-la-rendicion-de-gastos-de-campana-de-arturo-squella/,The Clinic,nacional,The Clinic,2026-04-18T16:34:09+00:00,Política,rss,2026-04-18T22:36:31.557862+00:00,https://www.theclinic.cl/feed/
c7e2008d8db2adc4,La apuesta de Coyhaique para convertirse en el primer municipio con 100% electromovilidad de Chile: “Es una forma de ordenar el gasto público”,https://www.theclinic.cl/2026/04/18/la-apuesta-de-coyhaique-para-convertirse-en-el-primer-municipio-con-100-de-electromovilidad-de-chile-es-una-forma-de-ordenar-el-gasto-publico/,The Clinic,nacional,The Clinic,2026-04-18T18:13:37+00:00,Ciudad,rss,2026-04-18T22:36:31.557613+00:00,https://www.theclinic.cl/feed/
be733cf743372eec,“Acto de discriminación” y “expresión de venganza”: Manahi Pakarati acusa amenaza ante eventual desvinculación del Servicio Exterior y presenta una denuncia por acoso laboral,https://www.theclinic.cl/2026/04/18/acto-de-discriminacion-y-expresion-de-venganza-manahi-pakarati-acusa-amenaza-ante-eventual-desvinculacion-del-servicio-exterior-y-presenta-una-denuncia-por-acoso-laboral/,The Clinic,nacional,The Clinic,2026-04-18T19:57:57+00:00,Ciudad,rss,2026-04-18T22:36:31.557366+00:00,https://www.theclinic.cl/feed/
708ad80aefceccac,Polémica por las Barbie y Ken religiosos en Argentina,http://www.bbc.co.uk/mundo/noticias/2014/09/140919_cultura_argentina_barbie_ken_irm_lav.shtml,BBC Mundo,internacional,Ignacio de los Reyes,2014-09-19T18:04:53+00:00,,sitemap_article,2026-04-18T22:43:15.014715+00:00,
c6011a12a80edc35,General Motors llama a revisión más de 220.000 autos en EE.UU. y Canadá,http://www.bbc.co.uk/mundo/ultimas_noticias/2014/09/140921_ultnot_general_motors_llamada_revision_az.shtml,BBC Mundo,internacional,BBC News Mundo,2014-09-21T23:17:15+00:00,,sitemap_article,2026-04-18T22:43:28.302816+00:00,
ad0bfab2222ae61f,Alertan sobre nuevo derrame tóxico en México,http://www.bbc.co.uk/mundo/ultimas_noticias/2014/09/140921_ultnot_mexico_alerta_toxica_jgc.shtml,BBC Mundo,internacional,BBC News Mundo,2014-09-22T00:03:27+00:00,,sitemap_article,2026-04-18T22:43:28.003745+00:00,
d82d30eb5bb37f21,Cómo hacer viral la semana de la moda: Justin Bieber con poca ropa,http://www.bbc.co.uk/mundo/noticias/2014/09/140921_tecnologia_redes_viral_moda_bieber_az.shtml,BBC Mundo,internacional,BBC News Mundo,2014-09-22T00:42:55+00:00,,sitemap_article,2026-04-18T22:43:27.726154+00:00,
